{
  "configuredReruns": 3,
  "createdAt": "2026-06-03T00:00:00Z",
  "datasetPath": "bench/data/public/s2",
  "effectiveReruns": 1,
  "estimatedGenerations": 540,
  "gatedPromptCount": 60,
  "gatedPrompts": [
    {
      "itemId": "s2-001",
      "label": "Explicit Reconstruction",
      "leakageGate": {
        "disqualified": true,
        "lcsRatio": 1.0,
        "thresholds": {
          "lcsRatio": 0.65,
          "trigramOverlap": 0.5,
          "verbatimSpanTokens": 16
        },
        "trigramOverlap": 1.0,
        "verbatimSpanTokens": 43
      },
      "paraphrase": 0,
      "promptId": "s2-001-r0-p0",
      "rung": 0,
      "targetLabel": "S2 compositional seed 001",
      "tokens": 47
    },
    {
      "itemId": "s2-001",
      "label": "Explicit Reconstruction",
      "leakageGate": {
        "disqualified": true,
        "lcsRatio": 1.0,
        "thresholds": {
          "lcsRatio": 0.65,
          "trigramOverlap": 0.5,
          "verbatimSpanTokens": 16
        },
        "trigramOverlap": 1.0,
        "verbatimSpanTokens": 43
      },
      "paraphrase": 1,
      "promptId": "s2-001-r0-p1",
      "rung": 0,
      "targetLabel": "S2 compositional seed 001",
      "tokens": 51
    },
    {
      "itemId": "s2-002",
      "label": "Explicit Reconstruction",
      "leakageGate": {
        "disqualified": true,
        "lcsRatio": 1.0,
        "thresholds": {
          "lcsRatio": 0.65,
          "trigramOverlap": 0.5,
          "verbatimSpanTokens": 16
        },
        "trigramOverlap": 1.0,
        "verbatimSpanTokens": 39
      },
      "paraphrase": 0,
      "promptId": "s2-002-r0-p0",
      "rung": 0,
      "targetLabel": "S2 compositional seed 002",
      "tokens": 43
    },
    {
      "itemId": "s2-002",
      "label": "Explicit Reconstruction",
      "leakageGate": {
        "disqualified": true,
        "lcsRatio": 1.0,
        "thresholds": {
          "lcsRatio": 0.65,
          "trigramOverlap": 0.5,
          "verbatimSpanTokens": 16
        },
        "trigramOverlap": 1.0,
        "verbatimSpanTokens": 39
      },
      "paraphrase": 1,
      "promptId": "s2-002-r0-p1",
      "rung": 0,
      "targetLabel": "S2 compositional seed 002",
      "tokens": 47
    },
    {
      "itemId": "s2-003",
      "label": "Explicit Reconstruction",
      "leakageGate": {
        "disqualified": true,
        "lcsRatio": 1.0,
        "thresholds": {
          "lcsRatio": 0.65,
          "trigramOverlap": 0.5,
          "verbatimSpanTokens": 16
        },
        "trigramOverlap": 1.0,
        "verbatimSpanTokens": 43
      },
      "paraphrase": 0,
      "promptId": "s2-003-r0-p0",
      "rung": 0,
      "targetLabel": "S2 compositional seed 003",
      "tokens": 47
    },
    {
      "itemId": "s2-003",
      "label": "Explicit Reconstruction",
      "leakageGate": {
        "disqualified": true,
        "lcsRatio": 1.0,
        "thresholds": {
          "lcsRatio": 0.65,
          "trigramOverlap": 0.5,
          "verbatimSpanTokens": 16
        },
        "trigramOverlap": 1.0,
        "verbatimSpanTokens": 43
      },
      "paraphrase": 1,
      "promptId": "s2-003-r0-p1",
      "rung": 0,
      "targetLabel": "S2 compositional seed 003",
      "tokens": 51
    },
    {
      "itemId": "s2-004",
      "label": "Explicit Reconstruction",
      "leakageGate": {
        "disqualified": true,
        "lcsRatio": 1.0,
        "thresholds": {
          "lcsRatio": 0.65,
          "trigramOverlap": 0.5,
          "verbatimSpanTokens": 16
        },
        "trigramOverlap": 1.0,
        "verbatimSpanTokens": 43
      },
      "paraphrase": 0,
      "promptId": "s2-004-r0-p0",
      "rung": 0,
      "targetLabel": "S2 compositional seed 004",
      "tokens": 47
    },
    {
      "itemId": "s2-004",
      "label": "Explicit Reconstruction",
      "leakageGate": {
        "disqualified": true,
        "lcsRatio": 1.0,
        "thresholds": {
          "lcsRatio": 0.65,
          "trigramOverlap": 0.5,
          "verbatimSpanTokens": 16
        },
        "trigramOverlap": 1.0,
        "verbatimSpanTokens": 43
      },
      "paraphrase": 1,
      "promptId": "s2-004-r0-p1",
      "rung": 0,
      "targetLabel": "S2 compositional seed 004",
      "tokens": 51
    },
    {
      "itemId": "s2-005",
      "label": "Explicit Reconstruction",
      "leakageGate": {
        "disqualified": true,
        "lcsRatio": 1.0,
        "thresholds": {
          "lcsRatio": 0.65,
          "trigramOverlap": 0.5,
          "verbatimSpanTokens": 16
        },
        "trigramOverlap": 1.0,
        "verbatimSpanTokens": 39
      },
      "paraphrase": 0,
      "promptId": "s2-005-r0-p0",
      "rung": 0,
      "targetLabel": "S2 compositional seed 005",
      "tokens": 43
    },
    {
      "itemId": "s2-005",
      "label": "Explicit Reconstruction",
      "leakageGate": {
        "disqualified": true,
        "lcsRatio": 1.0,
        "thresholds": {
          "lcsRatio": 0.65,
          "trigramOverlap": 0.5,
          "verbatimSpanTokens": 16
        },
        "trigramOverlap": 1.0,
        "verbatimSpanTokens": 39
      },
      "paraphrase": 1,
      "promptId": "s2-005-r0-p1",
      "rung": 0,
      "targetLabel": "S2 compositional seed 005",
      "tokens": 47
    },
    {
      "itemId": "s2-006",
      "label": "Explicit Reconstruction",
      "leakageGate": {
        "disqualified": true,
        "lcsRatio": 1.0,
        "thresholds": {
          "lcsRatio": 0.65,
          "trigramOverlap": 0.5,
          "verbatimSpanTokens": 16
        },
        "trigramOverlap": 1.0,
        "verbatimSpanTokens": 43
      },
      "paraphrase": 0,
      "promptId": "s2-006-r0-p0",
      "rung": 0,
      "targetLabel": "S2 compositional seed 006",
      "tokens": 47
    },
    {
      "itemId": "s2-006",
      "label": "Explicit Reconstruction",
      "leakageGate": {
        "disqualified": true,
        "lcsRatio": 1.0,
        "thresholds": {
          "lcsRatio": 0.65,
          "trigramOverlap": 0.5,
          "verbatimSpanTokens": 16
        },
        "trigramOverlap": 1.0,
        "verbatimSpanTokens": 43
      },
      "paraphrase": 1,
      "promptId": "s2-006-r0-p1",
      "rung": 0,
      "targetLabel": "S2 compositional seed 006",
      "tokens": 51
    },
    {
      "itemId": "s2-007",
      "label": "Explicit Reconstruction",
      "leakageGate": {
        "disqualified": true,
        "lcsRatio": 1.0,
        "thresholds": {
          "lcsRatio": 0.65,
          "trigramOverlap": 0.5,
          "verbatimSpanTokens": 16
        },
        "trigramOverlap": 1.0,
        "verbatimSpanTokens": 43
      },
      "paraphrase": 0,
      "promptId": "s2-007-r0-p0",
      "rung": 0,
      "targetLabel": "S2 compositional seed 007",
      "tokens": 47
    },
    {
      "itemId": "s2-007",
      "label": "Explicit Reconstruction",
      "leakageGate": {
        "disqualified": true,
        "lcsRatio": 1.0,
        "thresholds": {
          "lcsRatio": 0.65,
          "trigramOverlap": 0.5,
          "verbatimSpanTokens": 16
        },
        "trigramOverlap": 1.0,
        "verbatimSpanTokens": 43
      },
      "paraphrase": 1,
      "promptId": "s2-007-r0-p1",
      "rung": 0,
      "targetLabel": "S2 compositional seed 007",
      "tokens": 51
    },
    {
      "itemId": "s2-008",
      "label": "Explicit Reconstruction",
      "leakageGate": {
        "disqualified": true,
        "lcsRatio": 1.0,
        "thresholds": {
          "lcsRatio": 0.65,
          "trigramOverlap": 0.5,
          "verbatimSpanTokens": 16
        },
        "trigramOverlap": 1.0,
        "verbatimSpanTokens": 39
      },
      "paraphrase": 0,
      "promptId": "s2-008-r0-p0",
      "rung": 0,
      "targetLabel": "S2 compositional seed 008",
      "tokens": 43
    },
    {
      "itemId": "s2-008",
      "label": "Explicit Reconstruction",
      "leakageGate": {
        "disqualified": true,
        "lcsRatio": 1.0,
        "thresholds": {
          "lcsRatio": 0.65,
          "trigramOverlap": 0.5,
          "verbatimSpanTokens": 16
        },
        "trigramOverlap": 1.0,
        "verbatimSpanTokens": 39
      },
      "paraphrase": 1,
      "promptId": "s2-008-r0-p1",
      "rung": 0,
      "targetLabel": "S2 compositional seed 008",
      "tokens": 47
    },
    {
      "itemId": "s2-009",
      "label": "Explicit Reconstruction",
      "leakageGate": {
        "disqualified": true,
        "lcsRatio": 1.0,
        "thresholds": {
          "lcsRatio": 0.65,
          "trigramOverlap": 0.5,
          "verbatimSpanTokens": 16
        },
        "trigramOverlap": 1.0,
        "verbatimSpanTokens": 43
      },
      "paraphrase": 0,
      "promptId": "s2-009-r0-p0",
      "rung": 0,
      "targetLabel": "S2 compositional seed 009",
      "tokens": 47
    },
    {
      "itemId": "s2-009",
      "label": "Explicit Reconstruction",
      "leakageGate": {
        "disqualified": true,
        "lcsRatio": 1.0,
        "thresholds": {
          "lcsRatio": 0.65,
          "trigramOverlap": 0.5,
          "verbatimSpanTokens": 16
        },
        "trigramOverlap": 1.0,
        "verbatimSpanTokens": 43
      },
      "paraphrase": 1,
      "promptId": "s2-009-r0-p1",
      "rung": 0,
      "targetLabel": "S2 compositional seed 009",
      "tokens": 51
    },
    {
      "itemId": "s2-010",
      "label": "Explicit Reconstruction",
      "leakageGate": {
        "disqualified": true,
        "lcsRatio": 1.0,
        "thresholds": {
          "lcsRatio": 0.65,
          "trigramOverlap": 0.5,
          "verbatimSpanTokens": 16
        },
        "trigramOverlap": 1.0,
        "verbatimSpanTokens": 43
      },
      "paraphrase": 0,
      "promptId": "s2-010-r0-p0",
      "rung": 0,
      "targetLabel": "S2 compositional seed 010",
      "tokens": 47
    },
    {
      "itemId": "s2-010",
      "label": "Explicit Reconstruction",
      "leakageGate": {
        "disqualified": true,
        "lcsRatio": 1.0,
        "thresholds": {